keyword,wsk,superwsk,domains_count,tier_freq,top_competitor_url,is_whitespace
расчистка участка и вывоз мусора,115,115,5,СЧ,/uborka-dachnyh-uchastkov,0
расчистка участка от деревьев и кустарников цена,106,106,6,СЧ,/raschistka-uchastka-ot-derevev,0
расчистка участка цена,37,37,6,НЧ,/,0
стоимость расчистки участка от деревьев и кустарников цена за сотку,25,25,3,НЧ,/raschistka-uchastka-ot-derevev,0
стоимость расчистки участка,23,23,4,НЧ,/raschistka-uchastka-ot-derevev,1
сколько стоит расчистка участка,22,20,3,НЧ,/raschistka-uchastka-ot-derevev,1
сколько стоит расчистить участок,22,20,4,НЧ,/raschistka-uchastka-ot-derevev,1
уборка территории от мусора расценка в смете,21,21,2,НЧ,/uborka-territorii,0
уборка дачного участка цена за сотку под ключ,18,18,3,НЧ,/uborka-dachnyh-uchastkov,0
расчистка участка цена за сотку,17,17,4,НЧ,/raschistka-uchastka-ot-derevev,1
услуги по расчистке участка,16,16,1,НЧ,/raschistka-uchastka-ot-porosli-i-derevev,0
услуги по расчистке участка от деревьев и кустарников цена,14,14,4,НЧ,/raschistka-uchastka-ot-porosli-i-derevev,1
расчистка участка от деревьев и кустарников цена московская область,13,13,4,НЧ,/raschistka-uchastka-ot-porosli-i-derevev,0
расчистка участка от деревьев и кустарников цена за сотку,11,11,7,НЧ,/raschistka-uchastka-ot-derevev,0
уборка участка от деревьев и кустарников цена,10,10,3,НЧ,/raschistka-uchastka-ot-porosli-i-derevev,1
стоимость уборки территории за 1 метр квадратный,10,10,2,НЧ,/cleaning,0
уборка участка цена,9,9,1,НЧ,/uborka-dachnyh-uchastkov,0
расчистка участка от деревьев и кустарников расценка в смете,9,9,2,НЧ,/raschistka-uchastka-ot-derevev,0
расчистка участка от деревьев и кустарников цена за сотку московская область,8,7,4,НЧ,/raschistka-uchastka-ot-derevev,1
расчистить участок от деревьев и кустарников цена,8,8,5,НЧ,/services/raschistka-uchastka,1
расчистка участков от деревьев и кустарников цена,8,8,2,НЧ,/,0
уборка территории и вывоз мусора,7,7,3,НЧ,/cleaning,1
сколько стоит расчистить участок 10 соток,7,7,4,НЧ,/uborka-dachnyh-uchastkov,1
уборка участка и вывоз мусора,5,5,1,НЧ,/uborka-dachnyh-uchastkov,0
расчистить участок от деревьев и кустарников цена за сотку,5,5,3,НЧ,/raschistka-uchastka-ot-derevev,1
расчистка участка от деревьев цена за сотку,5,5,4,НЧ,/raschistka-uchastka-ot-derevev,1
расчистка участка цена в ленобласти,4,4,1,НЧ,/tsenyi,0
раскорчевка и расчистка участков цена,4,4,3,НЧ,/raschistka-uchastka-ot-derevev,0
уборка территории цена,4,4,1,НЧ,/cleaning,0
уборка территории от мусора цена,3,3,2,НЧ,/cleaning,0
сколько стоит расчистить участок от кустарников деревьев цены,3,3,3,НЧ,/raschistka-uchastka-ot-derevev,1
сколько стоит расчистить участок от деревьев,3,3,3,НЧ,/services/raschistka-uchastka,1
уборка участка и вывоз мусора цена в московской области,2,2,1,НЧ,/uborka-dachnyh-uchastkov,0
вывоз мусора уборка территорий,2,2,1,НЧ,/uborka-dachnyh-uchastkov,0
услуги по уборке территории от мусора,2,2,1,НЧ,/uborka-dachnyh-uchastkov,0
спил деревьев расчистка участка,2,2,3,НЧ,/price,1
сколько стоит снести дом и расчистить участок,2,2,1,НЧ,/snos-dachnykh-domov,0
расчистка участка от деревьев цена,1,1,3,НЧ,/,0
сколько стоит расчистка участка от деревьев,1,1,2,НЧ,/price,0
раскорчевка участка цена,1,1,3,НЧ,/raskorchevka-uchastka,1
расчистка участка под строительство цена,1,1,1,НЧ,/services/raschistka-uchastkov,0
уборка участка от травы и зарослей цена,1,1,1,НЧ,/services/raschistka-uchastka,0
расчистка участка от кустарников и мелколесья цена,1,1,1,НЧ,/services/raschistka-uchastka,0
